{
  "$schema": "https://github.com/newonei/pal-control/schemas/acceptance-gate-catalog/v1",
  "catalogVersion": "1.0.0",
  "manifestSchemaId": "https://github.com/newonei/pal-control/schemas/acceptance-evidence/v1",
  "manifestSchemaSha256": "sha256:52c8034bc807e39c9cbf52420e71a62f50269d393e56c4ee0fdaeb8202bfa1e5",
  "gates": [
    {
      "id": "p0-02-production-steam-openid",
      "priority": "P0",
      "title": "Production HTTPS Steam OpenID and reverse-proxy black-box acceptance",
      "todoReferences": ["TODO.md:112", "P0-02 acceptance criteria 1-3"],
      "allowedEnvironmentKinds": ["production"],
      "requiredExecutorRole": "operator",
      "requireExecutorNotImplementationContributor": false,
      "requireIndependentReviewer": true,
      "requireReviewerNotImplementationContributor": true,
      "minimumDurationSeconds": 1,
      "requiredPalworldVersion": "v1.0.1.100619",
      "requiredSteamBuild": "24181105",
      "requiredNativeCapability": null,
      "participantConstraints": [],
      "requiredArtifactRoles": [
        { "role": "openid-blackbox-trace", "minimum": 1 },
        { "role": "caddy-effective-config", "minimum": 1 },
        { "role": "cookie-security-capture", "minimum": 1 },
        { "role": "redacted-callback-log", "minimum": 1 }
      ],
      "requiredChecks": [
        "realm-return-to-exact",
        "forwarded-headers-correct",
        "secure-samesite-cookie",
        "callback-log-redacted",
        "state-nonce-replay-rejected",
        "cross-account-access-rejected",
        "old-world-session-write-rejected"
      ],
      "metricConstraints": [],
      "requiredRelatedGates": [],
      "notApplicablePolicy": null
    },
    {
      "id": "p0-04-current-native-probe",
      "priority": "P0",
      "title": "Current Palworld ABI/schema adaptation and read-only Native probe",
      "todoReferences": ["TODO.md:123", "P0-04 acceptance criteria 1-3"],
      "allowedEnvironmentKinds": ["controlled-live", "production"],
      "requiredExecutorRole": "native-operator",
      "requireExecutorNotImplementationContributor": false,
      "requireIndependentReviewer": true,
      "requireReviewerNotImplementationContributor": true,
      "minimumDurationSeconds": 1,
      "requiredPalworldVersion": "v1.0.1.100619",
      "requiredSteamBuild": "24181105",
      "requiredNativeCapability": null,
      "participantConstraints": [],
      "requiredArtifactRoles": [
        { "role": "native-readonly-probe", "minimum": 1 },
        { "role": "compatibility-matrix", "minimum": 1 },
        { "role": "loaded-module-inventory", "minimum": 1 },
        { "role": "legacy-loader-quarantine", "minimum": 1 }
      ],
      "requiredChecks": [
        "abi-schema-adapted",
        "readonly-probe-passed",
        "three-containers-observed",
        "version-combination-fixed",
        "legacy-dev36-loader-not-loaded"
      ],
      "metricConstraints": [],
      "requiredRelatedGates": [],
      "notApplicablePolicy": null
    },
    {
      "id": "p0-04-native-persistence",
      "priority": "P0",
      "title": "Native consume save-stop-restart-relogin persistence campaign",
      "todoReferences": ["TODO.md:124", "P0-04 acceptance criteria 1-3"],
      "allowedEnvironmentKinds": ["controlled-live", "production"],
      "requiredExecutorRole": "native-operator",
      "requireExecutorNotImplementationContributor": false,
      "requireIndependentReviewer": true,
      "requireReviewerNotImplementationContributor": true,
      "minimumDurationSeconds": 1,
      "requiredPalworldVersion": "v1.0.1.100619",
      "requiredSteamBuild": "24181105",
      "requiredNativeCapability": null,
      "participantConstraints": [
        { "role": "controlled-player", "minimum": 1, "maximum": null, "allMustNotBeImplementationContributors": false }
      ],
      "requiredArtifactRoles": [
        { "role": "inventory-before", "minimum": 1 },
        { "role": "consume-receipt", "minimum": 1 },
        { "role": "world-save", "minimum": 1 },
        { "role": "server-lifecycle", "minimum": 1 },
        { "role": "inventory-after-relogin", "minimum": 1 },
        { "role": "scenario-matrix", "minimum": 1 },
        { "role": "ledger-reconciliation", "minimum": 1 }
      ],
      "requiredChecks": [
        "empty-slot-persisted",
        "partial-stack-persisted",
        "multi-item-three-container-atomic",
        "same-key-replay-idempotent",
        "different-key-concurrency-conserved",
        "response-loss-not-retried",
        "disconnect-move-conflict-safe",
        "save-stop-restart-relogin-persisted",
        "no-partial-or-duplicate-credit"
      ],
      "metricConstraints": [
        { "id": "scenario-count", "operator": "gte", "value": 100, "unit": "count" },
        { "id": "partial-consume-count", "operator": "eq", "value": 0, "unit": "count" },
        { "id": "duplicate-consume-count", "operator": "eq", "value": 0, "unit": "count" },
        { "id": "unsupported-credit-count", "operator": "eq", "value": 0, "unit": "count" }
      ],
      "requiredRelatedGates": [],
      "notApplicablePolicy": null
    },
    {
      "id": "p0-06-paldefender-delivery-campaign",
      "priority": "P0",
      "title": "Fixed-version PalDefender structured delivery receipt campaign",
      "todoReferences": ["TODO.md:169", "P0-06 acceptance criteria 1-3"],
      "allowedEnvironmentKinds": ["controlled-live", "production"],
      "requiredExecutorRole": "operator",
      "requireExecutorNotImplementationContributor": false,
      "requireIndependentReviewer": true,
      "requireReviewerNotImplementationContributor": true,
      "minimumDurationSeconds": 1,
      "requiredPalworldVersion": "v1.0.1.100619",
      "requiredSteamBuild": "24181105",
      "requiredNativeCapability": null,
      "participantConstraints": [
        { "role": "controlled-player", "minimum": 1, "maximum": null, "allMustNotBeImplementationContributors": false }
      ],
      "requiredArtifactRoles": [
        { "role": "delivery-receipt-export", "minimum": 1 },
        { "role": "fault-boundary-matrix", "minimum": 1 },
        { "role": "delivery-duplicate-analysis", "minimum": 1 },
        { "role": "ledger-reconciliation", "minimum": 1 }
      ],
      "requiredChecks": [
        "natural-inventory-change-attribution-safe",
        "normal-path-conserved",
        "explicit-failure-conserved",
        "partial-path-reconciled",
        "response-loss-conserved",
        "timeout-path-conserved",
        "process-restart-conserved",
        "every-fault-boundary-repeated"
      ],
      "metricConstraints": [
        { "id": "total-delivery-count", "operator": "gte", "value": 200, "unit": "count" },
        { "id": "timeout-run-count", "operator": "gte", "value": 20, "unit": "count" },
        { "id": "partial-run-count", "operator": "gte", "value": 20, "unit": "count" },
        { "id": "process-restart-run-count", "operator": "gte", "value": 20, "unit": "count" },
        { "id": "minimum-runs-per-fault-boundary", "operator": "gte", "value": 20, "unit": "count" },
        { "id": "duplicate-delivery-count", "operator": "eq", "value": 0, "unit": "count" },
        { "id": "balance-discrepancy-count", "operator": "eq", "value": 0, "unit": "count" },
        { "id": "unsupported-refund-count", "operator": "eq", "value": 0, "unit": "count" }
      ],
      "requiredRelatedGates": [],
      "notApplicablePolicy": null
    },
    {
      "id": "p0-07-real-admin-rbac",
      "priority": "P0",
      "title": "Two-subject production administrator RBAC, revocation, MFA and audit drill",
      "todoReferences": ["TODO.md:184", "P0-07 acceptance criteria 1-3"],
      "allowedEnvironmentKinds": ["production"],
      "requiredExecutorRole": "security-operator",
      "requireExecutorNotImplementationContributor": false,
      "requireIndependentReviewer": true,
      "requireReviewerNotImplementationContributor": true,
      "minimumDurationSeconds": 1,
      "requiredPalworldVersion": "v1.0.1.100619",
      "requiredSteamBuild": "24181105",
      "requiredNativeCapability": null,
      "participantConstraints": [
        { "role": "administrator", "minimum": 2, "maximum": null, "allMustNotBeImplementationContributors": false }
      ],
      "requiredArtifactRoles": [
        { "role": "rbac-session-trace", "minimum": 1 },
        { "role": "mfa-revocation-trace", "minimum": 1 },
        { "role": "admin-audit-export", "minimum": 1 }
      ],
      "requiredChecks": [
        "anonymous-and-player-cookie-denied",
        "low-privilege-access-denied",
        "two-admin-subjects-isolated",
        "revocation-effective",
        "mfa-enforced",
        "actor-attribution-not-client-forgeable"
      ],
      "metricConstraints": [
        { "id": "admin-subject-count", "operator": "gte", "value": 2, "unit": "count" }
      ],
      "requiredRelatedGates": [],
      "notApplicablePolicy": null
    },
    {
      "id": "p0-09-independent-real-restores",
      "priority": "P0",
      "title": "Independent real world and economy backup restore exercises",
      "todoReferences": ["TODO.md:221", "P0-09 acceptance criteria 1-3"],
      "allowedEnvironmentKinds": ["production", "controlled-live"],
      "requiredExecutorRole": "duty-operator",
      "requireExecutorNotImplementationContributor": false,
      "requireIndependentReviewer": true,
      "requireReviewerNotImplementationContributor": true,
      "minimumDurationSeconds": 1,
      "requiredPalworldVersion": "v1.0.1.100619",
      "requiredSteamBuild": "24181105",
      "requiredNativeCapability": null,
      "participantConstraints": [],
      "requiredArtifactRoles": [
        { "role": "world-restore-report", "minimum": 1 },
        { "role": "economy-restore-report", "minimum": 1 },
        { "role": "rpo-rto-report", "minimum": 1 },
        { "role": "post-backup-transaction-reconciliation", "minimum": 1 }
      ],
      "requiredChecks": [